{
  "npc_id": "npc_su_mo",
  "current_turn": 8,
  "memory_policy_id": "npc_memory_policy_v1",
  "memory_nodes": [
    {
      "id": "mem_su_0001",
      "type": "episodic",
      "content": "苏墨昨夜潜入黑风岭外围，感应到血灵芝正在成型，约两日后完全成熟。",
      "created_turn": 0,
      "last_recalled_turn": 1,
      "recall_count": 1,
      "importance": 0.9,
      "salience": 0.85,
      "emotional_valence": 1.5,
      "confidence": 0.9,
      "source": "saw",
      "tier": "active",
      "valid": true,
      "invalid_at_turn": null,
      "contradicted_by": null,
      "related_entities": [
        "loc_black_wind_ridge"
      ],
      "score": 0.7372
    },
    {
      "id": "mem_su_0002",
      "type": "semantic",
      "content": "黑风岭深处有魔修残党活动痕迹，旧禁制仍在运作。",
      "created_turn": 0,
      "last_recalled_turn": 1,
      "recall_count": 1,
      "importance": 0.72,
      "salience": 0.65,
      "emotional_valence": -1,
      "confidence": 0.75,
      "source": "inferred",
      "tier": "active",
      "valid": true,
      "invalid_at_turn": null,
      "contradicted_by": null,
      "related_entities": [
        "loc_black_wind_ridge",
        "faction_demonic_remnants"
      ],
      "score": 0.6017
    },
    {
      "id": "mem_npc_su_mo_0007",
      "type": "episodic",
      "content": "那修士在主街上走了一圈，步伐均匀但视线在几个特定摊位停留——不是买货的眼神，是在找线索。他注意到了钱百味的异香草，但没有立刻过去。此人目的明确，不是普通散修。",
      "created_turn": 6,
      "last_recalled_turn": 6,
      "recall_count": 0,
      "importance": 0.6,
      "salience": 0.6,
      "emotional_valence": 0.2,
      "confidence": 0.65,
      "source": "saw",
      "tier": "active",
      "valid": true,
      "invalid_at_turn": null,
      "contradicted_by": null,
      "related_entities": [
        "pc_main",
        "npc_qian_baiwei",
        "loc_azure_cloud_market"
      ],
      "visibility_path": "direct_visual",
      "visibility_evidence": {
        "observer_id": "npc_su_mo",
        "memory_allowed": true,
        "visibility_path": "direct_visual",
        "event_id": "",
        "subjective_summary": "那修士在主街上走了一圈，步伐均匀但视线在几个特定摊位停留——不是买货的眼神，是在找线索。他注意到了钱百味的异香草，但没有立刻过去。此人目的明确，不是普通散修。",
        "allowed_memory_scope": [
          "observed_event"
        ],
        "forbidden_memory_scope": []
      },
      "observed_at": "第 1 日 08:55",
      "location_id": "loc_azure_cloud_market",
      "score": 0.5011
    },
    {
      "id": "mem_npc_su_mo_0009",
      "type": "episodic",
      "content": "那修士在巷子里冲击炼气三层，失败了。木火双灵根的灵光很纯粹，不是杂灵根——可惜功法粗陋，灵石品质也差。他若想短时间内突破，要么需要一枚三转聚气丹，要么需要一株年份足够的赤阳草。",
      "created_turn": 8,
      "last_recalled_turn": 8,
      "recall_count": 0,
      "importance": 0.5,
      "salience": 0.5,
      "emotional_valence": 0.2,
      "confidence": 0.7,
      "source": "saw",
      "tier": "dormant",
      "valid": true,
      "invalid_at_turn": null,
      "contradicted_by": null,
      "related_entities": [
        "pc_main"
      ],
      "visibility_path": "direct_visual",
      "visibility_evidence": {
        "observer_id": "npc_su_mo",
        "memory_allowed": true,
        "visibility_path": "direct_visual",
        "event_id": "",
        "subjective_summary": "那修士在巷子里冲击炼气三层，失败了。木火双灵根的灵光很纯粹，不是杂灵根——可惜功法粗陋，灵石品质也差。他若想短时间内突破，要么需要一枚三转聚气丹，要么需要一株年份足够的赤阳草。",
        "allowed_memory_scope": [
          "observed_event"
        ],
        "forbidden_memory_scope": []
      },
      "observed_at": "第 1 日 09:15",
      "location_id": "loc_azure_cloud_market",
      "score": 0.47
    },
    {
      "id": "mem_npc_su_mo_0003",
      "type": "episodic",
      "content": "茶摊远处听到有人在坊市入口与柳青交谈，提到了黑风岭。此人也在关注血灵芝。",
      "created_turn": 1,
      "last_recalled_turn": 1,
      "recall_count": 0,
      "importance": 0.6,
      "salience": 0.6,
      "emotional_valence": 0.2,
      "confidence": 0.5,
      "source": "heard",
      "tier": "dormant",
      "valid": true,
      "invalid_at_turn": null,
      "contradicted_by": null,
      "related_entities": [
        "npc_su_mo",
        "loc_azure_cloud_market"
      ],
      "visibility_path": "overheard",
      "observed_at": "第 1 日 08:10",
      "location_id": "loc_azure_cloud_market",
      "score": 0.4597
    },
    {
      "id": "mem_npc_su_mo_0004",
      "type": "episodic",
      "content": "茶摊远处听到有人在坊市入口与柳青交谈，提到了黑风岭。此人也在关注血灵芝。",
      "created_turn": 1,
      "last_recalled_turn": 1,
      "recall_count": 0,
      "importance": 0.6,
      "salience": 0.6,
      "emotional_valence": 0.2,
      "confidence": 0.5,
      "source": "heard",
      "tier": "dormant",
      "valid": true,
      "invalid_at_turn": null,
      "contradicted_by": null,
      "related_entities": [
        "npc_su_mo",
        "loc_azure_cloud_market"
      ],
      "visibility_path": "overheard",
      "observed_at": "第 1 日 08:20",
      "location_id": "loc_azure_cloud_market",
      "score": 0.4597
    },
    {
      "id": "mem_npc_su_mo_0006",
      "type": "episodic",
      "content": "那个新来的修士从坊市入口走进主街后没有直接去钱百味摊位，也没有去别处——他在街上走了一圈，像是在熟悉环境。不像是急着赶路的。",
      "created_turn": 5,
      "last_recalled_turn": 5,
      "recall_count": 0,
      "importance": 0.5,
      "salience": 0.5,
      "emotional_valence": 0.1,
      "confidence": 0.6,
      "source": "saw",
      "tier": "dormant",
      "valid": true,
      "invalid_at_turn": null,
      "contradicted_by": null,
      "related_entities": [
        "npc_su_mo",
        "pc_main",
        "loc_azure_cloud_market"
      ],
      "visibility_path": "direct_visual",
      "visibility_evidence": {
        "observer_id": "npc_su_mo",
        "memory_allowed": true,
        "visibility_path": "direct_visual",
        "event_id": "",
        "subjective_summary": "那个新来的修士从坊市入口走进主街后没有直接去钱百味摊位，也没有去别处——他在街上走了一圈，像是在熟悉环境。不像是急着赶路的。",
        "allowed_memory_scope": [
          "observed_event"
        ],
        "forbidden_memory_scope": []
      },
      "observed_at": "第 1 日 08:50",
      "location_id": "loc_azure_cloud_market",
      "score": 0.43
    },
    {
      "id": "mem_npc_su_mo_0008",
      "type": "episodic",
      "content": "那修士在主街上站了许久，似乎在做内视——看来修为不高，连敛息都做不到。不过他在坊市内逗留这么久，又不与任何人交谈，恐怕也是在等黑风岭的消息。",
      "created_turn": 7,
      "last_recalled_turn": 7,
      "recall_count": 0,
      "importance": 0.4,
      "salience": 0.4,
      "emotional_valence": 0.0,
      "confidence": 0.6,
      "source": "saw",
      "tier": "dormant",
      "valid": true,
      "invalid_at_turn": null,
      "contradicted_by": null,
      "related_entities": [
        "pc_main",
        "loc_azure_cloud_market"
      ],
      "visibility_path": "direct_visual",
      "visibility_evidence": {
        "observer_id": "npc_su_mo",
        "memory_allowed": true,
        "visibility_path": "direct_visual",
        "event_id": "",
        "subjective_summary": "那修士在主街上站了许久，似乎在做内视——看来修为不高，连敛息都做不到。不过他在坊市内逗留这么久，又不与任何人交谈，恐怕也是在等黑风岭的消息。",
        "allowed_memory_scope": [
          "observed_event"
        ],
        "forbidden_memory_scope": []
      },
      "observed_at": "第 1 日 09:10",
      "location_id": "loc_azure_cloud_market",
      "score": 0.3885
    },
    {
      "id": "mem_npc_su_mo_0005",
      "type": "episodic",
      "content": "坊市入口有个新来的修士和青云门的外门弟子说了几句。距离太远听不清内容，但那人没有被拦下——看来不是寻常散修。",
      "created_turn": 1,
      "last_recalled_turn": 1,
      "recall_count": 0,
      "importance": 0.4,
      "salience": 0.4,
      "emotional_valence": 0.1,
      "confidence": 0.5,
      "source": "saw",
      "tier": "dormant",
      "valid": true,
      "invalid_at_turn": null,
      "contradicted_by": null,
      "related_entities": [
        "npc_su_mo",
        "loc_azure_cloud_market"
      ],
      "visibility_path": "direct_visual",
      "observed_at": "第 1 日 08:25",
      "location_id": "loc_azure_cloud_market",
      "score": 0.3447
    }
  ],
  "interpretation_nodes": [],
  "understanding_nodes": [],
  "revision_events": [],
  "relation_edges": [],
  "beliefs": [],
  "plans": []
}
