{
  "npc_id": "npc_old_hermit",
  "current_turn": 1,
  "memory_policy_id": "npc_memory_policy_v1",
  "memory_nodes": [
    {
      "id": "mem_npc_old_hermit_0001",
      "type": "episodic",
      "content": "一个陌生修士在黑风岭边缘向他问路，询问血灵芝的方向。",
      "created_turn": 1,
      "last_recalled_turn": 1,
      "recall_count": 0,
      "importance": 0.5,
      "salience": 0.5,
      "emotional_valence": 0.0,
      "confidence": 0.8,
      "source": "saw",
      "tier": "active",
      "valid": true,
      "invalid_at_turn": null,
      "contradicted_by": null,
      "related_entities": [
        "npc_old_hermit",
        "loc_azure_cloud_market"
      ],
      "visibility_path": "direct_visual",
      "observed_at": "第 1 日 08:20",
      "location_id": "loc_azure_cloud_market"
    }
  ],
  "interpretation_nodes": [],
  "understanding_nodes": [],
  "revision_events": [],
  "relation_edges": [],
  "beliefs": [],
  "plans": []
}
