{
  "npc_id": "npc_qian_baiwei",
  "current_turn": 10,
  "memory_policy_id": "npc_memory_policy_v1",
  "memory_nodes": [
    {
      "id": "mem_qian_0001",
      "type": "episodic",
      "content": "钱百味前天从一个采药散修那里收到一批黑风岭产的异香草，比往年早了三日。",
      "created_turn": 0,
      "last_recalled_turn": 1,
      "recall_count": 2,
      "importance": 0.75,
      "salience": 0.8,
      "emotional_valence": 0.5,
      "confidence": 0.85,
      "source": "saw",
      "tier": "active",
      "valid": true,
      "invalid_at_turn": null,
      "contradicted_by": null,
      "related_entities": [
        "loc_black_wind_ridge"
      ],
      "score": 0.6352
    },
    {
      "id": "mem_qian_0002",
      "type": "semantic",
      "content": "钱百味知道魔修残党最近在收年份足的血灵芝，出价极高但不问来路。",
      "created_turn": 0,
      "last_recalled_turn": 1,
      "recall_count": 1,
      "importance": 0.7,
      "salience": 0.6,
      "emotional_valence": -0.5,
      "confidence": 0.6,
      "source": "heard",
      "tier": "active",
      "valid": true,
      "invalid_at_turn": null,
      "contradicted_by": null,
      "related_entities": [
        "faction_demonic_remnants"
      ],
      "score": 0.5432
    },
    {
      "id": "mem_npc_qian_baiwei_0007",
      "type": "episodic",
      "content": "那修士在主街上盘膝修炼了半个时辰，用了两块下品灵石冲击瓶颈，但失败了。他手上只剩两块灵石了——资源匮乏，应该会来找我交易。",
      "created_turn": 9,
      "last_recalled_turn": 9,
      "recall_count": 0,
      "importance": 0.5,
      "salience": 0.6,
      "emotional_valence": 0.2,
      "confidence": 0.9,
      "source": "saw",
      "tier": "active",
      "valid": true,
      "invalid_at_turn": null,
      "contradicted_by": null,
      "related_entities": [
        "pc_main"
      ],
      "visibility_path": "direct_visual",
      "visibility_evidence": {
        "observer_id": "npc_qian_baiwei",
        "memory_allowed": true,
        "visibility_path": "direct_visual",
        "event_id": "",
        "subjective_summary": "那修士在主街上盘膝修炼了半个时辰，用了两块下品灵石冲击瓶颈，但失败了。他手上只剩两块灵石了——资源匮乏，应该会来找我交易。",
        "allowed_memory_scope": [
          "observed_event"
        ],
        "forbidden_memory_scope": []
      },
      "observed_at": "第 1 日 10:15",
      "location_id": "loc_azure_cloud_market",
      "score": 0.4885
    },
    {
      "id": "mem_npc_qian_baiwei_0005",
      "type": "episodic",
      "content": "那修士在我摊位前走了两趟都没停，但视线在我摆的异香草上多停了一瞬。他在找东西，不是来闲逛的。我把异香草摆到台面上，看他会不会上钩。",
      "created_turn": 6,
      "last_recalled_turn": 6,
      "recall_count": 0,
      "importance": 0.5,
      "salience": 0.5,
      "emotional_valence": 0.3,
      "confidence": 0.7,
      "source": "saw",
      "tier": "dormant",
      "valid": true,
      "invalid_at_turn": null,
      "contradicted_by": null,
      "related_entities": [
        "pc_main",
        "loc_azure_cloud_market"
      ],
      "visibility_path": "direct_visual",
      "visibility_evidence": {
        "observer_id": "npc_qian_baiwei",
        "memory_allowed": true,
        "visibility_path": "direct_visual",
        "event_id": "",
        "subjective_summary": "那修士在我摊位前走了两趟都没停，但视线在我摆的异香草上多停了一瞬。他在找东西，不是来闲逛的。我把异香草摆到台面上，看他会不会上钩。",
        "allowed_memory_scope": [
          "observed_event"
        ],
        "forbidden_memory_scope": []
      },
      "observed_at": "第 1 日 08:55",
      "location_id": "loc_azure_cloud_market",
      "score": 0.4375
    },
    {
      "id": "mem_npc_qian_baiwei_0008",
      "type": "episodic",
      "content": "那修士疗伤修炼完后，灵石只剩两块了，还没来我摊位。他要么在犹豫，要么在等更好的机会。我再等等，他迟早会来。",
      "created_turn": 10,
      "last_recalled_turn": 10,
      "recall_count": 0,
      "importance": 0.4,
      "salience": 0.5,
      "emotional_valence": 0.1,
      "confidence": 0.85,
      "source": "saw",
      "tier": "dormant",
      "valid": true,
      "invalid_at_turn": null,
      "contradicted_by": null,
      "related_entities": [
        "pc_main"
      ],
      "visibility_path": "direct_visual",
      "visibility_evidence": {
        "observer_id": "npc_qian_baiwei",
        "memory_allowed": true,
        "visibility_path": "direct_visual",
        "event_id": "",
        "subjective_summary": "那修士疗伤修炼完后，灵石只剩两块了，还没来我摊位。他要么在犹豫，要么在等更好的机会。我再等等，他迟早会来。",
        "allowed_memory_scope": [
          "observed_event"
        ],
        "forbidden_memory_scope": []
      },
      "observed_at": "第 1 日 11:15",
      "location_id": "loc_azure_cloud_market",
      "score": 0.4375
    },
    {
      "id": "mem_npc_qian_baiwei_0003",
      "type": "episodic",
      "content": "牌坊下那个生面孔和柳青说了几句话。柳青被说得耳根发红——有趣，难得见这小子吃瘪。这人径直朝摊位区走来了。",
      "created_turn": 1,
      "last_recalled_turn": 1,
      "recall_count": 0,
      "importance": 0.5,
      "salience": 0.5,
      "emotional_valence": 0.3,
      "confidence": 0.7,
      "source": "saw",
      "tier": "dormant",
      "valid": true,
      "invalid_at_turn": null,
      "contradicted_by": null,
      "related_entities": [
        "npc_qian_baiwei",
        "loc_azure_cloud_market"
      ],
      "visibility_path": "direct_visual",
      "observed_at": "第 1 日 08:25",
      "location_id": "loc_azure_cloud_market",
      "score": 0.4107
    },
    {
      "id": "mem_npc_qian_baiwei_0004",
      "type": "episodic",
      "content": "牌坊下那个新来的修士走过我摊位前时放慢了脚步，但没有直接过来。他在观察——要么是在挑卖家，要么是在找什么人。",
      "created_turn": 5,
      "last_recalled_turn": 5,
      "recall_count": 0,
      "importance": 0.45,
      "salience": 0.5,
      "emotional_valence": 0.2,
      "confidence": 0.7,
      "source": "saw",
      "tier": "dormant",
      "valid": true,
      "invalid_at_turn": null,
      "contradicted_by": null,
      "related_entities": [
        "npc_qian_baiwei",
        "pc_main",
        "loc_azure_cloud_market"
      ],
      "visibility_path": "direct_visual",
      "visibility_evidence": {
        "observer_id": "npc_qian_baiwei",
        "memory_allowed": true,
        "visibility_path": "direct_visual",
        "event_id": "",
        "subjective_summary": "牌坊下那个新来的修士走过我摊位前时放慢了脚步，但没有直接过来。他在观察——要么是在挑卖家，要么是在找什么人。",
        "allowed_memory_scope": [
          "observed_event"
        ],
        "forbidden_memory_scope": []
      },
      "observed_at": "第 1 日 08:50",
      "location_id": "loc_azure_cloud_market",
      "score": 0.4084
    },
    {
      "id": "mem_npc_qian_baiwei_0006",
      "type": "episodic",
      "content": "那修士在街上站了好久，闭着眼睛像是在运功。看来是个囊中羞涩的散修，在犹豫要不要来买东西。我把异香草又往台面上挪了挪，看能不能引他过来。",
      "created_turn": 7,
      "last_recalled_turn": 7,
      "recall_count": 0,
      "importance": 0.3,
      "salience": 0.35,
      "emotional_valence": 0.1,
      "confidence": 0.8,
      "source": "saw",
      "tier": "dormant",
      "valid": true,
      "invalid_at_turn": null,
      "contradicted_by": null,
      "related_entities": [
        "pc_main",
        "loc_azure_cloud_market"
      ],
      "visibility_path": "direct_visual",
      "visibility_evidence": {
        "observer_id": "npc_qian_baiwei",
        "memory_allowed": true,
        "visibility_path": "direct_visual",
        "event_id": "",
        "subjective_summary": "那修士在街上站了好久，闭着眼睛像是在运功。看来是个囊中羞涩的散修，在犹豫要不要来买东西。我把异香草又往台面上挪了挪，看能不能引他过来。",
        "allowed_memory_scope": [
          "observed_event"
        ],
        "forbidden_memory_scope": []
      },
      "observed_at": "第 1 日 09:10",
      "location_id": "loc_azure_cloud_market",
      "score": 0.34
    }
  ],
  "interpretation_nodes": [],
  "understanding_nodes": [],
  "revision_events": [],
  "relation_edges": [],
  "beliefs": [],
  "plans": []
}
