{
  "npc_id": "npc_a_sentry",
  "current_turn": 7,
  "memory_policy_id": "npc_memory_policy_v1",
  "memory_nodes": [
    {
      "id": "mem_npc_a_sentry_0004",
      "type": "episodic",
      "content": "我绕回仓库正面时，看到主码头那边两个人靠得很近——那个瘦削的女人和之前蹲在木桩旁的人。他们好像在说什么，女人朝我这边看了一眼，然后拉着那人往码头边缘的阴影里挪。肯定有问题。",
      "created_turn": 3,
      "last_recalled_turn": 3,
      "recall_count": 0,
      "importance": 0.7,
      "salience": 0.8,
      "emotional_valence": -2.0,
      "confidence": 0.8,
      "source": "saw",
      "tier": "active",
      "valid": true,
      "invalid_at_turn": null,
      "contradicted_by": null,
      "related_entities": [
        "pc_main",
        "npc_mira"
      ],
      "visibility_path": "direct_visual",
      "visibility_evidence": {
        "observer_id": "npc_a_sentry",
        "memory_allowed": true,
        "visibility_path": "direct_visual",
        "event_id": "",
        "subjective_summary": "看到玩家和米拉在主码头靠近并朝阴影移动。",
        "allowed_memory_scope": [
          "observed_event"
        ],
        "forbidden_memory_scope": [
          "detail_of_conversation"
        ]
      },
      "observed_at": "第 1 日 20:25",
      "location_id": "loc_old_dock",
      "score": 0.6575
    },
    {
      "id": "mem_npc_a_sentry_0005",
      "type": "episodic",
      "content": "我完成一圈巡逻回到码头入口，朝主码头方向看了一眼——那边的阴影里似乎有两个人的轮廓，但光线太暗看不太清楚。我停在入口处没动，想看看他们会不会出来。",
      "created_turn": 4,
      "last_recalled_turn": 4,
      "recall_count": 0,
      "importance": 0.65,
      "salience": 0.75,
      "emotional_valence": -1.2,
      "confidence": 0.75,
      "source": "saw",
      "tier": "active",
      "valid": true,
      "invalid_at_turn": null,
      "contradicted_by": null,
      "related_entities": [
        "pc_main",
        "npc_mira",
        "loc_old_dock"
      ],
      "visibility_path": "direct_visual",
      "visibility_evidence": {
        "observer_id": "npc_a_sentry",
        "memory_allowed": true,
        "visibility_path": "direct_visual",
        "event_id": "",
        "subjective_summary": "在码头入口看到主码头阴影里有两个人影，但没看清是谁。",
        "allowed_memory_scope": [
          "observed_event"
        ],
        "forbidden_memory_scope": [
          "detail_of_conversation"
        ]
      },
      "observed_at": "第 1 日 20:35",
      "location_id": "loc_old_dock",
      "score": 0.595
    },
    {
      "id": "mem_a_0001",
      "type": "episodic",
      "content": "A 在旧码头巡夜时察觉缆绳堆附近有人盯着自己，但不能完全确认对方身份。",
      "created_turn": 1,
      "last_recalled_turn": 1,
      "recall_count": 1,
      "importance": 0.62,
      "salience": 0.7,
      "emotional_valence": -1,
      "confidence": 0.72,
      "source": "saw",
      "tier": "active",
      "valid": true,
      "invalid_at_turn": null,
      "contradicted_by": null,
      "related_entities": [
        "pc_main",
        "loc_old_dock",
        "feature_rope_piles"
      ],
      "score": 0.5805
    },
    {
      "id": "mem_npc_a_sentry_0003",
      "type": "episodic",
      "content": "我绕回仓库正面时，余光扫到主码头那边有个人蹲在木桩旁边，好像在检查什么。我没看清具体动作，但那个人影比之前更靠近水边了。",
      "created_turn": 2,
      "last_recalled_turn": 2,
      "recall_count": 0,
      "importance": 0.5,
      "salience": 0.6,
      "emotional_valence": -1.0,
      "confidence": 0.7,
      "source": "saw",
      "tier": "active",
      "valid": true,
      "invalid_at_turn": null,
      "contradicted_by": null,
      "related_entities": [
        "pc_main",
        "loc_old_dock"
      ],
      "visibility_path": "direct_visual",
      "visibility_evidence": {
        "observer_id": "npc_a_sentry",
        "memory_allowed": true,
        "visibility_path": "direct_visual",
        "event_id": "",
        "subjective_summary": "看到主码头有人蹲下检查木桩，但没看清具体动作。",
        "allowed_memory_scope": [
          "observed_event"
        ],
        "forbidden_memory_scope": [
          "detail_of_object"
        ]
      },
      "observed_at": "第 1 日 20:15",
      "location_id": "loc_old_dock",
      "score": 0.4859
    },
    {
      "id": "mem_npc_a_sentry_0002",
      "type": "episodic",
      "content": "我转向仓库侧边时，注意到主码头那个人还在原地，好像在检查木板缝隙。他没跟上来，但也没离开。",
      "created_turn": 1,
      "last_recalled_turn": 1,
      "recall_count": 0,
      "importance": 0.5,
      "salience": 0.6,
      "emotional_valence": -1.0,
      "confidence": 0.8,
      "source": "saw",
      "tier": "active",
      "valid": true,
      "invalid_at_turn": null,
      "contradicted_by": null,
      "related_entities": [
        "pc_main",
        "loc_old_dock"
      ],
      "visibility_path": "direct_visual",
      "visibility_evidence": {
        "observer_id": "npc_a_sentry",
        "memory_allowed": true,
        "visibility_path": "direct_visual",
        "event_id": "",
        "subjective_summary": "我转向仓库侧边时，注意到主码头那个人还在原地，好像在检查木板缝隙。他没跟上来，但也没离开。",
        "allowed_memory_scope": [
          "observed_event"
        ],
        "forbidden_memory_scope": []
      },
      "observed_at": "第 1 日 20:05",
      "location_id": "loc_old_dock",
      "score": 0.485
    },
    {
      "id": "mem_npc_a_sentry_0007",
      "type": "episodic",
      "content": "我在码头入口清理烟斗时，听到主码头阴影方向有低语声，但没看清是谁。",
      "created_turn": 7,
      "last_recalled_turn": 7,
      "recall_count": 0,
      "importance": 0.5,
      "salience": 0.5,
      "emotional_valence": 0.0,
      "confidence": 0.6,
      "source": "inferred",
      "tier": "dormant",
      "valid": true,
      "invalid_at_turn": null,
      "contradicted_by": null,
      "related_entities": [],
      "visibility_path": "inferred",
      "visibility_evidence": {
        "observer_id": "npc_a_sentry",
        "memory_allowed": true,
        "visibility_path": "inferred",
        "event_id": "",
        "subjective_summary": "我在码头入口清理烟斗时，听到主码头阴影方向有低语声，但没看清是谁。",
        "allowed_memory_scope": [
          "observed_event"
        ],
        "forbidden_memory_scope": []
      },
      "observed_at": "第 1 日 21:00",
      "location_id": "zone_dock_entrance",
      "score": 0.455
    },
    {
      "id": "mem_npc_a_sentry_0006",
      "type": "episodic",
      "content": "我看到玩家从南侧阴影返回主码头，与米拉会合。他们似乎在密谈。",
      "created_turn": 6,
      "last_recalled_turn": 6,
      "recall_count": 0,
      "importance": 0.5,
      "salience": 0.5,
      "emotional_valence": 0.0,
      "confidence": 0.6,
      "source": "inferred",
      "tier": "dormant",
      "valid": true,
      "invalid_at_turn": null,
      "contradicted_by": null,
      "related_entities": [],
      "visibility_path": "inferred",
      "visibility_evidence": {
        "observer_id": "npc_a_sentry",
        "memory_allowed": true,
        "visibility_path": "inferred",
        "event_id": "",
        "subjective_summary": "我看到玩家从南侧阴影返回主码头，与米拉会合。他们似乎在密谈。",
        "allowed_memory_scope": [
          "observed_event"
        ],
        "forbidden_memory_scope": []
      },
      "observed_at": "第 1 日 20:55",
      "location_id": "zone_dock_entrance",
      "score": 0.4435
    }
  ],
  "interpretation_nodes": [
    {
      "id": "interp_a_0001",
      "npc_id": "npc_a_sentry",
      "derived_from_event_id": "event_0001_player_observes_a",
      "derived_from_memory_id": "mem_a_0001",
      "text": "暗处的人可能在试探旧码头守卫；我应该先警觉，但不能贸然喊人。",
      "appraisal": {
        "goal_impact": "blocks",
        "threat_level": 0.58,
        "opportunity_level": 0.15,
        "agency": "unknown",
        "moral_judgment": "unknown",
        "relationship_signal": "suspicion"
      },
      "emotion": {
        "label": "curiosity",
        "valence": -1,
        "intensity": 0.55
      },
      "confidence": 0.65,
      "importance": 0.62,
      "related_entities": [
        "pc_main",
        "loc_old_dock",
        "feature_rope_piles"
      ],
      "possible_misunderstanding": true
    },
    {
      "id": "interp_npc_a_sentry_0002",
      "npc_id": "npc_a_sentry",
      "derived_from_event_id": "event_current_turn",
      "derived_from_memory_id": "mem_a_0001",
      "text": "那个人在检查码头，可能是来捞东西的，也可能是在等什么人。不像是巡夜人的同伙。",
      "appraisal": {
        "goal_impact": "unclear",
        "threat_level": 0.3,
        "opportunity_level": 0.3,
        "agency": "unknown",
        "moral_judgment": "unknown",
        "relationship_signal": "none"
      },
      "emotion": {
        "label": "none",
        "valence": 0,
        "intensity": 0
      },
      "confidence": 0.55,
      "importance": 0.45,
      "related_entities": [],
      "possible_misunderstanding": true
    }
  ],
  "understanding_nodes": [],
  "revision_events": [],
  "relation_edges": [
    {
      "id": "rel_a_suspects_observer",
      "type": "SUSPECTS",
      "from": "npc_a_sentry",
      "to": "pc_main",
      "memory_id": "mem_a_0001",
      "confidence": 0.45,
      "valid": true
    }
  ],
  "beliefs": [
    {
      "id": "belief_a_someone_watched",
      "text": "缆绳堆附近可能有人在观察我。",
      "truth_status": "unknown",
      "confidence": 0.72,
      "source_memory_ids": [
        "mem_a_0001"
      ]
    }
  ],
  "plans": [
    {
      "id": "plan_a_check_rope_piles",
      "text": "保持距离，绕开正面接近缆绳堆，先确认动静。",
      "priority": 0.58,
      "source_memory_ids": [
        "mem_a_0001"
      ],
      "status": "active"
    }
  ]
}
