{
  "npc_id": "npc_mysterious_man",
  "current_turn": 1,
  "memory_policy_id": "default",
  "memory_nodes": [
    {
      "id": "mem_npc_mysterious_man_0001",
      "type": "episodic",
      "content": "目标房间内传来轻微的精神力波动，有人在尝试占卜我。对方是个新手，序列不高，但已经觉醒。",
      "created_turn": 0,
      "last_recalled_turn": 0,
      "recall_count": 0,
      "importance": 0.5,
      "salience": 0.5,
      "emotional_valence": 0.0,
      "confidence": 0.6,
      "source": "inferred",
      "tier": "dormant",
      "valid": true,
      "invalid_at_turn": null,
      "contradicted_by": null,
      "related_entities": [],
      "visibility_path": "inferred",
      "visibility_evidence": {
        "observer_id": "npc_mysterious_man",
        "memory_allowed": true,
        "visibility_path": "inferred",
        "event_id": "",
        "subjective_summary": "目标房间内传来轻微的精神力波动，有人在尝试占卜我。对方是个新手，序列不高，但已经觉醒。",
        "allowed_memory_scope": [
          "observed_event"
        ],
        "forbidden_memory_scope": []
      },
      "observed_at": "第 1 日 00:10",
      "location_id": "zoutend_street",
      "score": 0.4435
    },
    {
      "id": "mem_npc_mysterious_man_0002",
      "type": "episodic",
      "content": "我在佐特兰德街监视目标公寓时，似乎感觉到有微弱的灵性波动从街角方向传来，但很轻微，可能是路过的野猫或醉汉。我没有发现目标离开房间。",
      "created_turn": 1,
      "last_recalled_turn": 1,
      "recall_count": 0,
      "importance": 0.3,
      "salience": 0.2,
      "emotional_valence": 0.0,
      "confidence": 0.4,
      "source": "inferred",
      "tier": "dormant",
      "valid": true,
      "invalid_at_turn": null,
      "contradicted_by": null,
      "related_entities": [],
      "visibility_path": "inferred",
      "visibility_evidence": {
        "observer_id": "npc_mysterious_man",
        "memory_allowed": true,
        "visibility_path": "inferred",
        "event_id": "",
        "subjective_summary": "我在佐特兰德街监视目标公寓时，似乎感觉到有微弱的灵性波动从街角方向传来，但很轻微，可能是路过的野猫或醉汉。我没有发现目标离开房间。",
        "allowed_memory_scope": [
          "observed_event"
        ],
        "forbidden_memory_scope": []
      },
      "observed_at": "第 1 日 00:20",
      "location_id": "zoutend_street",
      "score": 0.315
    }
  ],
  "interpretation_nodes": [],
  "understanding_nodes": [],
  "revision_events": [],
  "relation_edges": [],
  "beliefs": [],
  "plans": []
}
