{
  "npc_id": "npc_b_clerk",
  "current_turn": 7,
  "memory_policy_id": "npc_memory_policy_v1",
  "memory_nodes": [
    {
      "id": "mem_npc_b_clerk_0001",
      "type": "episodic",
      "content": "我一直在抄写货单，没有注意到外面的异常。",
      "created_turn": 7,
      "last_recalled_turn": 7,
      "recall_count": 0,
      "importance": 0.5,
      "salience": 0.5,
      "emotional_valence": 0.0,
      "confidence": 0.6,
      "source": "inferred",
      "tier": "dormant",
      "valid": true,
      "invalid_at_turn": null,
      "contradicted_by": null,
      "related_entities": [],
      "visibility_path": "inferred",
      "visibility_evidence": {
        "observer_id": "npc_b_clerk",
        "memory_allowed": true,
        "visibility_path": "inferred",
        "event_id": "",
        "subjective_summary": "我一直在抄写货单，没有注意到外面的异常。",
        "allowed_memory_scope": [
          "observed_event"
        ],
        "forbidden_memory_scope": []
      },
      "observed_at": "第 1 日 21:00",
      "location_id": "zone_dock_entrance",
      "score": 0.455
    }
  ],
  "interpretation_nodes": [],
  "understanding_nodes": [],
  "revision_events": [],
  "relation_edges": [],
  "beliefs": [],
  "plans": []
}
